{
  "$schema": "../../schemas/technologies.schema.json",
  "title": "Wix",
  "technology": "Wix",
  "condition": [
    {
      "type": "RESPONSE_HEADER_MATCH",
      "payload": {
        "name": "x-wix-request-id",
        "type": "START_WITH",
        "value": ""
      }
    }
  ],
  "proxyHosts": ["siteassets.parastorage.com"]
}
